{
  "$schema": "../schemas/architecture-conformance.schema.json",
  "schemaVersion": 1,
  "generator": "scripts/check_architecture_registry.py",
  "sourceRevision": "a3af7d31eba029421138b9b5824345340a4a238c",
  "inputs": {
    "designVersion": 2,
    "topologySchemaVersion": 5
  },
  "summary": {
    "analyzedProjects": 13,
    "retainedSymbols": 8993,
    "observedComponentDependencies": 85,
    "declaredDependencies": 75,
    "acceptedExceptions": 1,
    "undeclaredDependencies": 9,
    "forbiddenDependencies": 0,
    "unownedShippingProjects": 0,
    "unownedShippingSymbols": 0,
    "unresolvedTypeDependencies": 286,
    "registryMismatches": 0
  },
  "componentDependencies": [
    {
      "source": "app",
      "target": "app-main-window",
      "references": 464,
      "typeDependencyCount": 29,
      "classification": "declared",
      "evidence": [
        {
          "source": "Excise.App.Views.MainWindow",
          "target": "Excise.App.ViewModels.MainWindowViewModel",
          "references": 179
        }
      ]
    },
    {
      "source": "app-main-window",
      "target": "app",
      "references": 753,
      "typeDependencyCount": 79,
      "classification": "declared",
      "evidence": [
        {
          "source": "Excise.App.ViewModels.MainWindowViewModel",
          "target": "Excise.App.Services.PdfDocumentService",
          "references": 125
        }
      ]
    },
    {
      "source": "avalonia",
      "target": "core",
      "references": 7,
      "typeDependencyCount": 2,
      "classification": "declared",
      "evidence": [
        {
          "source": "Excise.Avalonia.Controls.TypewriterEditorBox",
          "target": "Excise.Core.Graphics.PdfColor",
          "references": 4
        }
      ]
    },
    {
      "source": "avalonia",
      "target": "core-document",
      "references": 513,
      "typeDependencyCount": 61,
      "classification": "declared",
      "evidence": [
        {
          "source": "Excise.Avalonia.Controls.PdfViewerControl",
          "target": "Excise.Core.Document.PdfRectangle",
          "references": 35
        }
      ]
    },
    {
      "source": "avalonia",
      "target": "core-primitives",
      "references": 11,
      "typeDependencyCount": 3,
      "classification": "declared",
      "evidence": [
        {
          "source": "Excise.Avalonia.Controls.DecodedImageSampleRetention",
          "target": "Excise.Core.Primitives.PdfStream",
          "references": 6
        }
      ]
    },
    {
      "source": "avalonia",
      "target": "core-text",
      "references": 63,
      "typeDependencyCount": 19,
      "classification": "declared",
      "evidence": [
        {
          "source": "Excise.Avalonia.Controls.SinglePageView",
          "target": "Excise.Core.Text.TextSelectionEngine",
          "references": 14
        }
      ]
    },
    {
      "source": "avalonia",
      "target": "rendering",
      "references": 25,
      "typeDependencyCount": 4,
      "classification": "declared",
      "evidence": [
        {
          "source": "Excise.Avalonia.Controls.ContinuousPageView",
          "target": "Excise.Rendering.RenderOptions",
          "references": 10
        }
      ]
    },
    {
      "source": "cli",
      "target": "core",
      "references": 43,
      "typeDependencyCount": 12,
      "classification": "declared",
      "evidence": [
        {
          "source": "Excise.Cli.Program",
          "target": "Excise.Core.Automation.PdfCommandIds",
          "references": 16
        }
      ]
    },
    {
      "source": "cli",
      "target": "core-content",
      "references": 10,
      "typeDependencyCount": 3,
      "classification": "declared",
      "evidence": [
        {
          "source": "Excise.Cli.Commands.AutodetectFieldsCommand",
          "target": "Excise.Core.Document.SuggestedField",
          "references": 6
        }
      ]
    },
    {
      "source": "cli",
      "target": "core-document",
      "references": 174,
      "typeDependencyCount": 53,
      "classification": "declared",
      "evidence": [
        {
          "source": "Excise.Cli.Commands.FormMutationHandler",
          "target": "Excise.Core.Document.PdfDocument",
          "references": 11
        }
      ]
    },
    {
      "source": "cli",
      "target": "core-encryption",
      "references": 37,
      "typeDependencyCount": 15,
      "classification": "declared",
      "evidence": [
        {
          "source": "Excise.Cli.Commands.EncryptionCommandHandler",
          "target": "Excise.Core.Security.PdfEncryptionOptions",
          "references": 6
        }
      ]
    },
    {
      "source": "cli",
      "target": "core-parsing",
      "references": 2,
      "typeDependencyCount": 2,
      "classification": "declared",
      "evidence": [
        {
          "source": "Excise.Cli.Commands.EncryptionCommandHandler",
          "target": "Excise.Core.Parsing.PdfEncryptionNotSupportedException",
          "references": 1
        }
      ]
    },
    {
      "source": "cli",
      "target": "core-redaction",
      "references": 231,
      "typeDependencyCount": 51,
      "classification": "declared",
      "evidence": [
        {
          "source": "Excise.Cli.Commands.UnredactCommandHandler",
          "target": "Excise.Core.Redaction.Recovery.RecoveryScanner.Channels",
          "references": 18
        }
      ]
    },
    {
      "source": "cli",
      "target": "core-security",
      "references": 28,
      "typeDependencyCount": 6,
      "classification": "declared",
      "evidence": [
        {
          "source": "Excise.Cli.Commands.ValidateCommand",
          "target": "Excise.Core.Validation.ValidationResult",
          "references": 12
        }
      ]
    },
    {
      "source": "cli",
      "target": "core-text",
      "references": 8,
      "typeDependencyCount": 2,
      "classification": "declared",
      "evidence": [
        {
          "source": "Excise.Cli.Commands.LetterInspectionHandler",
          "target": "Excise.Core.Text.Letter",
          "references": 6
        }
      ]
    },
    {
      "source": "cli",
      "target": "core-writing",
      "references": 34,
      "typeDependencyCount": 9,
      "classification": "declared",
      "evidence": [
        {
          "source": "Excise.Cli.Commands.OptimizeCommand",
          "target": "Excise.Core.Writing.PdfOptimizationResult",
          "references": 16
        }
      ]
    },
    {
      "source": "cli",
      "target": "ocr",
      "references": 86,
      "typeDependencyCount": 26,
      "classification": "declared",
      "evidence": [
        {
          "source": "Excise.Cli.Commands.RedactCommand",
          "target": "Excise.Ocr.TermRedactionResult",
          "references": 11
        }
      ]
    },
    {
      "source": "cli",
      "target": "rendering",
      "references": 27,
      "typeDependencyCount": 7,
      "classification": "declared",
      "evidence": [
        {
          "source": "Excise.Cli.Commands.UnredactCommandHandler",
          "target": "Excise.Rendering.Differential.ResidueRecoveryEngine.Gap",
          "references": 8
        }
      ]
    },
    {
      "source": "core",
      "target": "core-document",
      "references": 370,
      "typeDependencyCount": 67,
      "classification": "declared",
      "evidence": [
        {
          "source": "Excise.Core.Xfa.PdfXfaLayout",
          "target": "Excise.Core.Document.PdfDocument",
          "references": 28
        }
      ]
    },
    {
      "source": "core",
      "target": "core-fonts",
      "references": 46,
      "typeDependencyCount": 6,
      "classification": "declared",
      "evidence": [
        {
          "source": "Excise.Core.Graphics.PdfTrueTypeFont",
          "target": "Excise.Core.Fonts.TrueTypeFontFile",
          "references": 33
        }
      ]
    },
    {
      "source": "core",
      "target": "core-parsing",
      "references": 2,
      "typeDependencyCount": 1,
      "classification": "declared",
      "evidence": [
        {
          "source": "Excise.Core.Graphics.PdfTrueTypeFont",
          "target": "Excise.Core.Filters.BasicStreamFilters",
          "references": 2
        }
      ]
    },
    {
      "source": "core",
      "target": "core-primitives",
      "references": 547,
      "typeDependencyCount": 117,
      "classification": "declared",
      "evidence": [
        {
          "source": "Excise.Core.Xfa.XfaWidgetWriter.Builder",
          "target": "Excise.Core.Primitives.PdfDictionary",
          "references": 37
        }
      ]
    },
    {
      "source": "core",
      "target": "core-redaction",
      "references": 19,
      "typeDependencyCount": 3,
      "classification": "declared",
      "evidence": [
        {
          "source": "Excise.Core.Xfa.XfaStaticDataSync.Snapshot",
          "target": "Excise.Core.Operations.XfaXmlCarrier",
          "references": 8
        }
      ]
    },
    {
      "source": "core",
      "target": "core-text",
      "references": 2,
      "typeDependencyCount": 1,
      "classification": "declared",
      "evidence": [
        {
          "source": "Excise.Core.Graphics.PdfFont",
          "target": "Excise.Core.Text.UnicodeTextSafety",
          "references": 2
        }
      ]
    },
    {
      "source": "core-content",
      "target": "core-document",
      "references": 112,
      "typeDependencyCount": 19,
      "classification": "declared",
      "evidence": [
        {
          "source": "Excise.Core.Content.ContentStreamWalker",
          "target": "Excise.Core.Document.PdfPage",
          "references": 21
        }
      ]
    },
    {
      "source": "core-content",
      "target": "core-fonts",
      "references": 66,
      "typeDependencyCount": 17,
      "classification": "declared",
      "evidence": [
        {
          "source": "Excise.Core.Content.ContentStreamWalker",
          "target": "Excise.Core.Text.GlyphUnicodeDecoder",